{"schemaVersion":"1.0","id":"m10-volcanic-forge-material-responses","version":"0.1.0","status":"approved","materialPack":{"id":"m10-volcanic-forge-materials","version":"0.1.0"},"responses":[{"id":"m10-obsidian","version":"1.0.0","base":{"color":"#1A1110","opacity":1,"sourceId":"m10-obsidian-grain"},"edge":{"color":"#6F3D23","opacity":0.8,"sourceId":"m10-forged-brass"},"highlight":{"color":"#C98339","opacity":0.3},"glow":{"color":"#D8571D","opacity":0.18},"surface":{"color":"#422017","opacity":0.1,"sourceId":"m10-obsidian-grain"}},{"id":"m10-forged-brass-response","version":"1.0.0","base":{"color":"#6B3E20","opacity":1,"sourceId":"m10-forged-brass"},"edge":{"color":"#E7AC58","opacity":0.9,"sourceId":"m10-forged-brass"},"highlight":{"color":"#FFD27A","opacity":0.56},"glow":{"color":"#E56A23","opacity":0.26},"surface":{"color":"#B66A2F","opacity":0.1,"sourceId":"m10-forged-brass"}},{"id":"m10-lava-core","version":"1.0.0","base":{"color":"#692313","opacity":0.92,"sourceId":"m10-lava-crack"},"edge":{"color":"#FF8A2C","opacity":0.84,"sourceId":"m10-lava-crack"},"highlight":{"color":"#FFD27A","opacity":0.64},"glow":{"color":"#FF5B1A","opacity":0.55,"sourceId":"m10-lava-crack"},"surface":{"color":"#F17624","opacity":0.12,"sourceId":"m10-lava-crack"}}],"bindings":[{"componentId":"primary-hex-button","region":"structural-edge","responseId":"m10-forged-brass-response"},{"componentId":"primary-hex-button","region":"content-surface","responseId":"m10-lava-core"},{"componentId":"secondary-hex-button","region":"structural-edge","responseId":"m10-forged-brass-response"},{"componentId":"secondary-hex-button","region":"content-surface","responseId":"m10-obsidian"},{"componentId":"panel","region":"structural-edge","responseId":"m10-forged-brass-response"},{"componentId":"panel","region":"content-surface","responseId":"m10-obsidian"},{"componentId":"panel","region":"focal-surface","responseId":"m10-lava-core"},{"componentId":"tab","region":"structural-edge","responseId":"m10-forged-brass-response"},{"componentId":"tab","region":"content-surface","responseId":"m10-obsidian"},{"componentId":"badge","region":"structural-edge","responseId":"m10-forged-brass-response"},{"componentId":"badge","region":"content-surface","responseId":"m10-lava-core"},{"componentId":"progress","region":"structural-edge","responseId":"m10-forged-brass-response"},{"componentId":"progress","region":"content-surface","responseId":"m10-lava-core"},{"componentId":"icon-container","region":"structural-edge","responseId":"m10-forged-brass-response"},{"componentId":"icon-container","region":"content-surface","responseId":"m10-obsidian"},{"componentId":"icon-container","region":"focal-surface","responseId":"m10-lava-core"}],"compatibility":{"minimumRendererVersion":"0.1.0","migrationNote":"Lava glow is capped at 0.55 by the approved M10 emission limit."}}
