{"schemaVersion":"1.0","id":"m11-enchanted-forest-material-responses","version":"0.1.0","status":"approved","materialPack":{"id":"m11-enchanted-forest-materials","version":"0.1.0"},"responses":[{"id":"m11-stone-response","version":"1.0.0","base":{"color":"#173025","opacity":1,"sourceId":"m11-weathered-stone"},"edge":{"color":"#55745A","opacity":0.78,"sourceId":"m11-weathered-stone"},"highlight":{"color":"#A7C99A","opacity":0.28},"glow":{"color":"#4BBE8D","opacity":0.18},"surface":{"color":"#315140","opacity":0.12,"sourceId":"m11-weathered-stone"}},{"id":"m11-wood-response","version":"1.0.0","base":{"color":"#352E24","opacity":1,"sourceId":"m11-dark-wood"},"edge":{"color":"#806B49","opacity":0.72,"sourceId":"m11-dark-wood"},"highlight":{"color":"#C2B886","opacity":0.3},"glow":{"color":"#66B980","opacity":0.12},"surface":{"color":"#4E4431","opacity":0.14,"sourceId":"m11-dark-wood"}},{"id":"m11-moss-light-response","version":"1.0.0","base":{"color":"#345D45","opacity":0.92,"sourceId":"m11-moss-light"},"edge":{"color":"#83C979","opacity":0.72,"sourceId":"m11-moss-light"},"highlight":{"color":"#C7E6A6","opacity":0.46},"glow":{"color":"#65D5A4","opacity":0.4,"sourceId":"m11-moss-light"},"surface":{"color":"#5B9D67","opacity":0.12,"sourceId":"m11-moss-light"}}],"bindings":[{"componentId":"primary-hex-button","region":"content-surface","responseId":"m11-moss-light-response"},{"componentId":"secondary-hex-button","region":"content-surface","responseId":"m11-wood-response"},{"componentId":"panel","region":"content-surface","responseId":"m11-wood-response"},{"componentId":"tab","region":"content-surface","responseId":"m11-wood-response"},{"componentId":"badge","region":"content-surface","responseId":"m11-moss-light-response"},{"componentId":"progress","region":"content-surface","responseId":"m11-moss-light-response"},{"componentId":"icon-container","region":"content-surface","responseId":"m11-wood-response"}],"compatibility":{"minimumRendererVersion":"0.1.0","migrationNote":"Glow capped at 0.40."}}
